{
  "schema_version": "account_health_panel.v1",
  "workbench": "Daily Closeout",
  "panel": "Account Health Panel",
  "route": "/closeout",
  "fixture_state": "happy_path",
  "context": {
    "trading_day": "2026-06-13",
    "session_id": "session.demo-20260613",
    "closeout_run_id": "closeout.run.20260613.001",
    "reducer_checkpoint_id": "reducer.checkpoint.20260613.001",
    "reducer_checkpoint_ts": "2026-06-13T08:35:00Z",
    "stream_state": "healthy",
    "last_cursor": 742,
    "source_ref": "fixture://ui/daily-closeout/account-health-happy-path.json",
    "checksum": "sha256:aaaaaaaaaaaaaaaaaaaaaaaaaaaaaaaaaaaaaaaaaaaaaaaaaaaaaaaaaaaaaaaa"
  },
  "summary": {
    "total_accounts": 2,
    "closeout_completed": 2,
    "closeout_blocked": 0,
    "settlement_blocked": 0,
    "stale_or_partial": 0,
    "open_blockers": 0
  },
  "filters": {
    "account_types": ["real_feed_sandbox_paper", "broker_paper_probe"],
    "closeout_states": ["complete"],
    "settlement_states": ["settled"],
    "blocker_severities": []
  },
  "accounts": [
    {
      "account_id": "paper.demo-01",
      "account_type": "real_feed_sandbox_paper",
      "owner": "pm-alpha",
      "closeout_state": "complete",
      "settlement_state": "settled",
      "equity_continuity": "continuous",
      "blocker_count": 0,
      "source_ref": "readmodel://daily-closeout/2026-06-13/paper.demo-01",
      "checksum": "sha256:1111111111111111111111111111111111111111111111111111111111111111",
      "closeout_run_id": "closeout.run.20260613.001",
      "settlement_run_id": "settlement.run.20260613.001",
      "equity_curve_artifact_id": "artifact.equity.paper.demo-01.20260613",
      "latest_blocker_id": null,
      "last_cursor": 381,
      "last_checkpoint_ts": "2026-06-13T08:33:20Z",
      "blockers": []
    },
    {
      "account_id": "probe.demo-02",
      "account_type": "broker_paper_probe",
      "owner": "ops-beta",
      "closeout_state": "complete",
      "settlement_state": "settled",
      "equity_continuity": "continuous",
      "blocker_count": 0,
      "source_ref": "readmodel://daily-closeout/2026-06-13/probe.demo-02",
      "checksum": "sha256:2222222222222222222222222222222222222222222222222222222222222222",
      "closeout_run_id": "closeout.run.20260613.001",
      "settlement_run_id": "settlement.run.20260613.002",
      "equity_curve_artifact_id": "artifact.equity.probe.demo-02.20260613",
      "latest_blocker_id": null,
      "last_cursor": 742,
      "last_checkpoint_ts": "2026-06-13T08:35:00Z",
      "blockers": []
    }
  ]
}
